{
  "version": 1,
  "spec": "urn:eatf:spec:key-mirror:1.0",
  "generatedAt": "2026-05-13T09:49:00.000Z",
  "previousManifestSha256": "",
  "anchors": [
    {
      "kid": "kid_demo_genesis_2026_05",
      "algorithm": "RSA-4096",
      "publicKeyPem": "-----BEGIN PUBLIC KEY-----\nMIICIjANBgkqhkiG9w0BAQEFAAOCAg8AMIICCgKCAgEAyFEjd9Ztpdtm/0zfEojg\nuDFDi6PZhpnPHk9q/inZnk7bRUJYdQBCSdDoIEk/kZ84bt8DXOZz8xK/jkKSyMe7\nGTEXU3HQiP41oRUczNDLQcAXrCZ60a2R+EvvOGZ9wNqjTuecljbb1A6d6Kvll8Wc\numffoJ0H5RxrmmvAkoxp5Im7xycqSfpqfzJiDYLmNHr4GbCqBpKxC2cC/CK8RdFv\nWdEBVUHSwdZPhzNdnfuqSUrhRkXlOpIbD3a7nCmGm6YXw5MCO6xL0hM7yTm/SE++\n21vk/dXxaBp54Jx0dgmddmoiJ81fjupYlDu9hOXkvWrRPbqQKjB5av4S3T23mcJW\nNDgr2pdqAoMngJHjtszVYMZfzd2OmYJSjlSIdYfgIQp1fIrMnCThsG/3WHa6YNU5\nKYQZlXZWBonoCxNUPD/uHgYCCrHQupfVcwexJPe1jViQtW1HzUoYwpjUZH8J4uP4\n8ylfFYm80YAuYgJDYViELJ49L3GNLzKAXVnLy638CNgV/ofU0Iio+GjVvXsaLsbD\nu83sRQPGx/sKrSAcn6joIb365LWgIIpZC2yhAPy61NFvyoC1ckWUDts9bSfLir3n\nwFmFNEpGH9FhFpHHxtc8NAGFxjoT2F51DG2n/dKulXv9Ndd2Q8kjs4HlHKHRqiVX\nZA0WuUGesX45r5wjBZgn1rkCAwEAAQ==\n-----END PUBLIC KEY-----\n",
      "fingerprintSha256": "62:63:3B:14:6B:BF:2A:C1:D6:87:49:CC:F5:17:A2:CC:F9:E5:66:12:55:F4:C3:59:39:A6:5E:00:65:43:8F:37",
      "validFrom": "2026-05-13T00:00:00.000Z",
      "ceremonyLogPath": "ceremony-logs/2026-05-13-demo-genesis.md",
      "notes": "DEMO genesis anchor \u2014 generated 2026-05-13 to bootstrap the eatf-trust-anchors mirror. The corresponding private key is a DEMO key on the operator's dev machine, NOT in HSM, NOT to be used to sign any production .aep package or audit-log archive. The first real production ceremony will append a new anchor and retire this one (by setting retiredAt)."
    }
  ]
}
